product name,bundle flag,no of units,total price,unit price
Shirakiku Ramune Carbonated Soft Drink Soda 200 ml - Grape (200 ml),0,1,10.98,10.98
"Coke Zero Sugar Cola Soda, 12 oz, 24 Pack (Package May Vary)",1,24,nan,
"Zevia All Natural Soda, Black Cherry Zero, 12 Fl Oz (Pack of 6)",1,6,nan,
"Zevia Zero Calorie Cherry Cola Soda, 16 Fluid Ounce - 12 per case.",1,12,23.99,1.9991666666666665
"Ramune Japanese Soda, Grape, 6.76 Fluid Ounce, Pack of 8",1,8,24.99,3.12375
"Blue Sky Root Beer Soda Soft Drink, 12 fl oz, 6 Pack",1,6,6.95,1.1583333333333334
"Pepsi, Diet Pepsi, 12 oz (pack of 12)",1,12,nan,
"Fanta Pineapple Soda Fruit Flavored Soft Drink, 2 Liter Bottle",0,1,nan,nan
"365 by Whole Foods Market, Juice Apple Organic, 64 Fl Oz",0,1,nan,nan
Frescolita Fress Kolita Fresskolita Carbonated Origanal Venezuelan Soda Soft Drink 2 Liter Soda,0,1,13.85,13.85
"Sprite Mini-Cans, 7.5 fl oz (Pack of 24)",1,24,22.02,0.9175
Coco Rico Coconut Soda 12oz can (6pack),1,6,19.00,3.1666666666666665
"Barq's Red Creme Soda Soft Drink, 12 Fl Oz, 36 Pack, Red Creme, 12 Fl Oz () , 12 Fl Oz (Pack of 1)",1,36,93.00,2.5833333333333335
"Zevia Zero Calorie Soda, Creamy Root Beer, 12 Ounce Cans (Pack of 24)",1,24,nan,
"Coke Zero Cherry 20 oz Bottles (Pack of 10, Total of 200 Fl OZ)",1,10,25.99,2.5989999999999998
"San Pellegrino, Momenti Sparkling Drink Pomegranate Blackcurrant, 11.15 Fl Oz, 6 Pack",1,6,17.29,2.8816666666666664
"Jarritos Jamaica Natural Flavor Soft Soda Drink, With Real Sugar, 12.5oz Bottle (Pack of 6, Total of 75 Fl Oz)",1,6,25.90,4.316666666666666
"San Pellegrino, Soda Clementina, 11.15 Fl Oz, 6 Pack",1,6,nan,
"Sprite Lemon Lime Soda Soft Drinks, 8.5 fl oz, 12 Pack",1,12,31.00,2.5833333333333335
"Zevia, Soda Mountain Z, 12 Fl Oz, 6 Pack",1,6,nan,
"OLIPOP - Sparkling Tonic, Healthy Soda, Prebiotic Soft Drinks, Supports Digestive Health & Gut Health, 9g of Dietary Plant Fiber, Low Calorie, Low Sugar, Vegan, 12 oz, 6 Pack (Classic Root Beer)",1,6,23.99,3.998333333333333
"Jarritos Mexican Soft Soda Drink, Grapefruit, Mandarin, Lime - Variety Pack, 12.5oz Glass Bottle (Pack of 6, Total of 75 Fl Oz)",1,6,20.99,3.498333333333333
"Diet Coke Caffeine Free Soda Soft Drink, 12 fl oz, 24 Pack",1,24,nan,
"TaB Diet Cola Soda, 12 Ounce (12 Cans)",1,12,29.99,2.4991666666666665
Zevia Zero Calorie Soda - Ginger Ale - Case of 2 - 12 Fl oz.,1,2,35.73,17.865
Capri Sun Pacific Cooler Ready-to-Drink Juice (10 Pouches),1,10,nan,
"KOIOS - Sparkling Citrus Fit Soda, Zero Calorie Soft Drink, Muscle Recovery Soda, Hydrating Electrolytes & BCAAs for Energy, Great Flavor, No Sugar, Caffeine-Free, Gluten-Free (12 oz, 12 Count)",1,12,nan,
"Virgil’s, Zero Sugar Cola, Great Tasting Zero Calorie Keto Friendly Soda (12- 12oz cans)",1,unknown,32.98,unknown
Squirt Original Grapefruit Soda Mini-Cans Soft Drink - 10 Pk (7.5 oz),1,10,19.49,1.9489999999999998
"Barq's Red Creme Soda Soft Drink, 12 Fl Oz, 36 Pack, Red Creme, 12 Fl Oz () , 12 Fl Oz (Pack of 1)",1,36,93.00,2.5833333333333335
"Virgil's, Soda Cream, 12 Fl Oz, 4 Pack",1,4,nan,
(Mix Case) Sioux City Soda Variety -Mix of 4 Flavors (12 Pack),1,12,42.50,3.5416666666666665
"Bundle of Orange Soda Mini Soda Cans, 7.5 oz Soft Drinks Bulk Snacks Pack, Small Refrigerator & Snack Pantry Drink 12 Count Beverage Bedroom & Kitchen Supplies",1,12,19.99,1.6658333333333333
"Coke Zero Sugar Cola Soda, 16.9 oz, 6 Pack (Package May Vary)",1,6,nan,
"A&W Root Beer Mini Soda Cans, 7.5 oz Soft Drinks Bulk Snacks Pack, Small Refrigerator & Snack Pantry Drink 12 Count Beverage Bedroom & Kitchen Supplies",1,12,20.69,1.7241666666666668
"Mountain Dew, Code Red, Cherry, 12 oz (pack of 12)",1,12,nan,
"Pibb Xtra Fridge Pack Soda Soft Drinks, 12 fl oz, 12 Pack",1,unknown,nan,unknown
Zevia Soft Drink - Dr. Zevia - 12 oz - 24 ct,1,24,25.56,1.065
"Coca-Cola Mini-Cans, 7.5 fl oz (Pack of 24)",1,24,nan,
"""Oran Soda"" Soft Drink 11.15 Fluid Ounce (33cl) Cans (Pack of 6) [ Italian Import ]",1,6,29.00,4.833333333333333
"NEW MTN DEW Thrashed Apple 12 fl oz can, 12 count",1,12,25.14,2.095
"Regatta Craft Mixers, Classic Ginger Beer, All-Natural Ingredients, Non-GMO, 7.5oz, Case of 24 Sleek Cans",1,24,27.99,1.16625
"Coca-Cola Soft Drink Variety Pack, 12 Fluid Ounce, 36 Pack",1,unknown,nan,unknown
Power for Apple Ramune gift set 8 variety pack (Original Version),1,unknown,39.95,unknown
"AmishTastes Kutztown ""Nix Besser"" Birch Beer, Favorite Amish Drink, 24 Oz. Bottles (Pack of 4)",1,4,21.50,5.375
"Stewart Sodas Diet Root Beer, 4pk, 12 oz",1,4,25.00,6.25
"LOTTE Milkis Soda Beverage, Peach, 8.5 Fluid Ounce (Pack of 6)",1,6,13.34,2.223333333333333
"Fever-Tree Premium Club Soda, 16.9 Fl Oz Glass Bottle (8 Count)",1,8,27.98,3.4975
"Canada Dry Ginger Ale Mini Soda Cans, 7.5 oz Soft Drinks Bulk Snacks Pack, Small Refrigerator & Snack Pantry Drink 18 Count Beverage Kitchen Supplies",1,18,24.99,1.3883333333333332
"7 UP Soda Soft Drink, 20-Ounce (Pack of 24)",1,24,nan,
"Soda Variety Pack (18 Cans) Bundle of Coke, Pepsi Cola, Dr Pepper, Mountain Dew, Sprite and Canada Dry Ginger Ale Soft Drinks, Mini Fridge Organizer Can Restock Kit",1,18,27.69,1.5383333333333333
"DR PEPPER Cherry Zero Sugar Soda, 12 fl oz cans, 12 pack",1,12,17.99,1.4991666666666665
"Zevia Zero Calorie Soda, Rainbow Variety Pack, 12 Ounce Cans (Pack of 24)",1,24,24.99,1.04125
"Mountain Dew, 12 oz (pack of 12)",1,12,nan,
